title,overview,release_date,vote_average,vote_count,genres,original_language
Spider-Man: Homecoming,"Following the events of Captain America: Civil War, Peter Parker, with the help of his mentor Tony Stark, tries to balance his life as an ordinary high school student in Queens, New York City, with fighting crime as his superhero alter ego Spider-Man as a new threat, the Vulture, emerges.",2017-07-05,7.333,21879,"Action, Adventure, Science Fiction, Drama",en
One Love,"Kassa a free-wheelin rasta man, falls for a straight laced gospel singer Serena, when they both meet as they enter a music contest. Serena's father the pastor forbids her to see him and wants her to marry one of his church members. Meanwhile the record boss organizing the contest, tries to get Kassa's band to sign to his label on his terms not theirs. By using heavy tactics, he pushes the band to fight back.",2003-05-18,5.6,15,"Drama, Romance",en
Mortal World,"Mermer family, who has been managing a restaurant called “Anatolian flavors” in Haydarpasa train station for generations, consist of 8 members. Even though this family leads a quiet simple life, they will end up finding themselves in complicated situations. Moreover, this family has been keeping a secret for a long time and it just can’t come out at any cost..",2018-01-26,7.1,168,"Comedy, Action, Crime",tr
,Spider-Man and Marvel's Super Heroes take on a mischievous Loki and a team of super villains in an all-new LEGO adventure.,,6.7,13,"Animation, Unknown",en
Justice League,"Fuelled by his restored faith in humanity and inspired by Superman's selfless act, Bruce Wayne and Diana Prince assemble a team of metahumans consisting of Barry Allen, Arthur Curry and Victor Stone to face the catastrophic threat of Steppenwolf and the Parademons who are on the hunt for three Mother Boxes on Earth.",2017-11-15,6.1,12991,"Action, Adventure, Science Fiction",en
Ghost Rider,"In order to save his dying father, young stunt cyclist Johnny Blaze sells his soul to Mephistopheles and sadly parts from the pure-hearted Roxanne Simpson, the love of his life. Years later, Johnny's path crosses again with Roxanne, now a go-getting reporter, and also with Mephistopheles, who offers to release Johnny's soul if Johnny becomes the fabled, fiery 'Ghost Rider'.",2007-01-15,5.6,5946,"Thriller, Action, Fantasy",en
The Meg,"A deep sea submersible pilot revisits his past fears in the Mariana Trench, and accidentally unleashes the seventy foot ancestor of the Great White Shark believed to be extinct.",2018-08-09,6.253,7670,"Action, Science Fiction, Horror",en
,"Take control of an adventure set in the Minecraft universe. The future of the world is at stake, and your decisions shape the story -- so choose wisely!",,8.0,24,"Unknown, Comedy, Animation, Unknown",en
LEGO Marvel Avengers: Code Red,"The Avengers gather to celebrate their latest victory, but their celebration is quickly interrupted by the mysterious disappearance of Black Widow's father, Red Guardian. As the Avengers investigate, they discover that Red Guardian isn't the only one missing when they meet a dangerous new foe quite unlike anything they've ever encountered before.",2023-10-26,6.6,108,"Animation, Action, Family",en
I'm Glad I Did,"Metin Akpınar has not been on the theater stage since 1992. In addition to TV series and movies, new generations were able to meet him with Devekuşu Kabare's six plays that could be recorded. As if it was written today, those who watched had a taste of his unique acting in current plays. It was an acting that accompanied his talent and his intellectual background. ""I'm Glad I Did"", when transferring through the years Metin Akpinar he brought his own narrative, on the other hand, offers a different approach to Turkey's recent history, leaving an archive for the future by refreshing memory.",2020-07-28,7.8,12,Documentary,tr
,Animated series about a couple of odd little beings.,,5.556,9,"Animation, Family, Comedy, Unknown",en
Locked on You,A meatball seller gets into trouble so flees Istanbul to find a new life on a beautiful island.,2018-11-29,5.6,32,Comedy,tr
,"Furry little bunnies hop through wild adventures as they find solutions, fun and sometimes mischief wherever there is light.",,2.7,3,"Unknown, Animation",be
,"Curious Booba is now a chef! With friends Loola and Spike, he creates tasty treats with delightful designs using fruits, vegetables and other food.",,8.0,1,"Animation, Unknown",en
,"Having spent the summer engaging common criminals with his new-found powers, not so typical 16-year-old Peter Parker must conceal his secret identity and battle super-villains in the real world as he enters his junior year of high school.",,8.6,798,"Unknown, Animation, Unknown, Family",en
The Lego Movie,"An ordinary Lego mini-figure, mistakenly thought to be the extraordinary MasterBuilder, is recruited to join a quest to stop an evil Lego tyrant from conquering the universe.",2014-02-06,7.418,7866,"Animation, Family, Adventure, Comedy, Fantasy",en
Kong: Skull Island,"Explore the mysterious and dangerous home of the king of the apes as a team of explorers ventures deep inside the treacherous, primordial island.",2017-03-08,6.543,10465,"Action, Adventure, Fantasy",en
Recep Ivedik 6,"Recep İvedik is at home watching television, when postman brings him a surprise invitation for the annual dried beans festival of Konya province. Very excited with the news, Recep convinces his best friend Nurullah to join him but due to a miscommunication with the travel agency, they get plane tickets for Kenya, Africa, instead of Konya, Turkey. After arriving at Kenya and getting on a safari tour, our hapless companions find themselves lost in endless savannah and at the middle of two rival local tribes. Many adventures await Recep in this unfamiliar and exotic land, who will try anything and everything to return home, mostly to hilarious results.",2019-11-07,4.5,100,Comedy,tr
PAW Patrol: The Mighty Movie,"A magical meteor crash lands in Adventure City and gives the PAW Patrol pups superpowers, transforming them into The Mighty Pups.",2023-09-21,7.0,463,"Animation, Family, Action, Science Fiction, Comedy, Drama, Adventure",en
LEGO Marvel Spider-Man: Vexed by Venom,"Thanks to Green Goblin and Venom, tech theft is now at an all-time high. Can our Friendly Neighborhood Spider-Man put an end to their mysterious villainous scheme before all of New York City is destroyed?",2019-08-03,6.397,34,"Animation, Action",en
,"Monster House is a Discovery Channel television program that documented the themed remodeling of a residence in a five-day time frame. In 2004, the episode ""Zen House"" was nominated for a Primetime Emmy Award for Outstanding Main Title Theme Music for its opening song by composer Dan Mackenzie.

In early 2006, Discovery Channel announced the show had been canceled and the final episode, titled ""Farewell House"", aired in February.

Monster House is now running in reruns in 2012 on Spike TV.",,0.0,0,,en
Enes Batur: Gerçek Kahraman,,2019-05-31,3.6,11,Comedy,tr
The Incredible Hulk,"Scientist Bruce Banner scours the planet for an antidote to the unbridled force of rage within him: the Hulk. But when the military masterminds who dream of exploiting his powers force him back to civilization, he finds himself coming face to face with a new, deadly foe.",2008-06-12,6.214,11810,"Science Fiction, Action, Adventure",en
Bücür,,2018-09-21,5.7,3,"Family, Comedy",tr
Recep Ivedik 2,"When his grandmother takes ill, foolish brute Recep tries to satisfy her wishes by getting a job and attempting to find a suitable wife.",2009-02-13,4.6,130,Comedy,tr
Recep Ivedik 3,"Recep Ivedik has been depressed since the death of his grandmother. Everyone who tries to help him fails. A young girl named Zeynep, who can't find an apartment, stays with Recep. Initially, the two can't stand each others but after a while, they grow close. Despite many adventures together, Recep's depression won't go away. That is until he experiences something he had never experienced before.",2010-02-12,4.6,120,Comedy,tr
Godzilla x Kong: The New Empire,"Following their explosive showdown, Godzilla and Kong must reunite against a colossal undiscovered threat hidden within our world, challenging their very existence – and our own.",2024-03-27,7.127,3955,"Action, Adventure, Science Fiction",en
Transformers,Young teenager Sam Witwicky becomes involved in the ancient struggle between two extraterrestrial factions of transforming robots – the heroic Autobots and the evil Decepticons. Sam holds the clue to unimaginable power and the Decepticons will stop at nothing to retrieve it.,2007-06-27,6.8,11334,"Adventure, Science Fiction, Action",en
Batman Begins,"Driven by tragedy, billionaire Bruce Wayne dedicates his life to uncovering and defeating the corruption that plagues his home, Gotham City.  Unable to work within the system, he instead creates a new identity, a symbol of fear for the criminal underworld - The Batman.",2005-06-10,7.7,21097,"Action, Crime, Drama",en
,"In the crowded ports of Alaska and the Pacific Northwest sit a handful of salty, machine-fueled, deadline-driven workplaces powered by a nautical breed of hard-working, fun-loving men and women. These boat-repairing operations range in size from small mom-and-pop outfits to massive enterprises blanketing entire coastlines, and they all have one goal in common: fix and build boats fast and make money doing it.",,1.8,2,"Documentary, Unknown",en
Dedemin Fişi,,2016-01-22,5.3,41,Comedy,tr
Blind Love,"A blind man and a deaf woman fall in love with each other, but their disabilities cause major communication problems.",2021-07-22,10.0,1,Romance,sw
Brother in Love,"A robbery leaves a proprietor penniless before his wedding, but becoming a son-in-law to a second family might be the financial solution he needs.",2019-05-24,6.8,53,"Comedy, Family",tr
,"Due to a political conspiracy, an innocent man is sent to death row and his only hope is his brother, who makes it his mission to deliberately get himself sent to the same prison in order to break the both of them out, from the inside out.",,8.1,5221,"Unknown, Crime, Drama",en
Spider-Man,"After being bitten by a genetically altered spider at Oscorp, nerdy but endearing high school student Peter Parker is endowed with amazing powers to become the superhero known as Spider-Man.",2002-05-01,7.303,19210,"Action, Science Fiction",en
Tall Girl,"Jodi, the tallest girl in her high school, has always felt uncomfortable in her own skin. But after years of slouching, being made fun of, and avoiding attention at all costs, Jodi finally decides to find the confidence to stand tall.",2019-09-13,6.318,1869,"Comedy, Drama, Romance",en
The Amazing Spider-Man,"Peter Parker is an outcast high schooler abandoned by his parents as a boy, leaving him to be raised by his Uncle Ben and Aunt May. Like most teenagers, Peter is trying to figure out who he is and how he got to be the person he is today. As Peter discovers a mysterious briefcase that belonged to his father, he begins a quest to understand his parents' disappearance – leading him directly to Oscorp and the lab of Dr. Curt Connors, his father's former partner. As Spider-Man is set on a collision course with Connors' alter ego, The Lizard, Peter will make life-altering choices to use his powers and shape his destiny to become a hero.",2012-06-23,6.71,17440,"Action, Adventure, Science Fiction",en
,"When a young boy vanishes, a small town uncovers a mystery involving secret experiments, terrifying supernatural forces, and one strange little girl.",,8.6,17861,"Drama, Unknown, Mystery, Unknown",en
,"The Pritchett-Dunphy-Tucker clan is a wonderfully large and blended family. They give us an honest and often hilarious look into the sometimes warm, sometimes twisted, embrace of the modern family.",,7.865,2828,Comedy,en
The Hunger Games,"Every year in the ruins of what was once North America, the nation of Panem forces each of its twelve districts to send a teenage boy and girl to compete in the Hunger Games.  Part twisted entertainment, part government intimidation tactic, the Hunger Games are a nationally televised event in which “Tributes” must fight with one another until one survivor remains.  Pitted against highly-trained Tributes who have prepared for these Games their entire lives, Katniss is forced to rely upon her sharp instincts as well as the mentorship of drunken former victor Haymitch Abernathy.  If she’s ever to return home to District 12, Katniss must make impossible choices in the arena that weigh survival against humanity and life against love. The world will be watching.",2012-03-12,7.215,22035,"Science Fiction, Adventure, Fantasy",en
The Last Summer,"Standing on the precipice of adulthood, a group of friends navigate new relationships, while reexamining others, during their final summer before college.",2019-05-03,6.014,1369,"Romance, Comedy",en
The Amazing Spider-Man 2,"For Peter Parker, life is busy. Between taking out the bad guys as Spider-Man and spending time with the person he loves, Gwen Stacy, high school graduation cannot come quickly enough. Peter has not forgotten about the promise he made to Gwen’s father to protect her by staying away, but that is a promise he cannot keep. Things will change for Peter when a new villain, Electro, emerges, an old friend, Harry Osborn, returns, and Peter uncovers new clues about his past.",2014-04-16,6.516,13306,"Action, Adventure, Science Fiction",en
Spider-Man 3,"The seemingly invincible Spider-Man goes up against an all-new crop of villains—including the shape-shifting Sandman. While Spider-Man’s superpowers are altered by an alien organism, his alter ego, Peter Parker, deals with nemesis Eddie Brock and also gets caught up in a love triangle.",2007-05-01,6.4,14185,"Action, Adventure, Science Fiction",en
Predestination,"Predestination chronicles the life of a Temporal Agent sent on an intricate series of time-travel journeys designed to prevent future killers from committing their crimes. Now, on his final assignment, the Agent must stop the one criminal that has eluded him throughout time and prevent a devastating attack in which thousands of lives will be lost.",2014-08-28,7.432,6469,"Science Fiction, Thriller",en
Kill Bill: Vol. 2,"The Bride unwaveringly continues on her roaring rampage of revenge against the band of assassins who had tried to kill her and her unborn child. She visits each of her former associates one-by-one, checking off the victims on her Death List Five until there's nothing left to do … but kill Bill.",2004-04-16,7.876,13940,"Action, Crime, Thriller",en
Kill Bill: Vol. 1,"An assassin is shot by her ruthless employer, Bill, and other members of their assassination circle – but she lives to plot her vengeance.",2003-10-10,7.971,17493,"Action, Crime",en
Recep Ivedik 4,Recep Ivedik coaches the children football team in his neighborhood. For the training he uses the only free piece of land as football field on which he used to play football as a child. Recep notices sadly that this piece of land was sold to a businessman. So as not to loose this for the neighborhood and the children valuable piece of land he decides to re-buy it on his own. With his own methods he does not receive the money. The participation in a competition with a big price is the only solution of his problem ...,2014-02-20,4.4,121,Comedy,tr
,"When the fate of their world, Ninjago, is challenged by great threats, it's up to the ninja: Kai, Jay, Cole, Zane, Lloyd and Nya to save the world.",,7.9,711,"Animation, Unknown, Unknown, Comedy",en
The Gift,Simon and Robyn are a young married couple whose life is going as planned until a chance run-in with Simon's high school acquaintance sends their world into a tailspin.,2015-07-31,6.693,3211,"Thriller, Mystery, Drama",en
,"In 1920s Madrid, four women at the National Telephone Company ring in revolution as they deal with romance, envy and the modern workplace.",,7.8,471,Drama,es
,A missing child causes four families to help each other for answers. What they could not imagine is that this mystery would be connected to innumerable other secrets of the small town.,,8.42,6748,"Crime, Drama, Unknown, Mystery",de
,"Hell-bent on exacting revenge and proving he was framed for his sister's murder, Álex sets out to unearth much more than the crime's real culprit.",,7.6,1168,"Drama, Crime, Mystery",es
,"40-year old political leader Birgitte Nyborg secures her party a landslide victory through her idealism and huge effort, then faces the biggest challenge of her life: how most effectively to use the newly won seats, and how far she is willing to go in order to gain as much influence as possible.",,8.0,209,Drama,da
,"Inspired by actual events, this true crime anthology series takes a deep dive into the dark, twisted minds of terrorists and follows the brave souls who hunt them down.",,7.6,434,"Crime, Mystery",en
,"Two complete strangers, Lola and Chelsea, intervene in a fatal carjacking while waiting at a suburban bus stop, and are subsequently thrust into a chase from authorities across Australia with a vehicle filled with cash. The strangers must rely solely on each other while on the run.",,7.0,68,"Crime, Drama",en
,"In a small New York town, a haunted detective hunts for answers about perplexing crimes while wrestling with his own demons.",,7.471,1061,"Crime, Drama",en
,"Detectives Tori Lustigman and Nick Manning are assigned a brutal murder case in Bondi, where they begin to uncover mounting evidence to suggest the killing is connected to a spate of unexplained deaths, ""suicides"" and disappearances of gay men throughout the 80s and 90s. Haunted by the disappearance of her teenage brother, Tori's fascination with the case soon turns to fixation. When more ritualistic murders occur with the same bizarre signature, Tori and Nick will need to put their relationships, their careers and their lives on the line to finally reveal the truth.",,6.4,38,"Crime, Drama",en
,"Dicle finds herself in an agency when she comes to Istanbul dreaming of becoming a filmmaker. There’s only place for stars, ego wars, greed, fame, money, hope and disappointment here. As Dicle struggles to exist in this glamorous world without losing her way... Her broken family ties start to bleed again. Her father who abandoned them before she was born is now one of the sharks of the industry and they are working in the same agency. And the magical lights of cinema start to shed light on Dicle’s first love.",,6.1,12,"Drama, Comedy, Documentary",tr
,"In a 1950s orphanage, a young girl reveals an astonishing talent for chess and begins an unlikely journey to stardom while grappling with addiction.",,8.475,4670,Drama,en
Leyla Everlasting,"A resilient housewife, her husband and their marriage therapist become mired in a toxic love triangle and a plot to obtain an antique manuscript.",2020-12-04,3.774,42,Comedy,tr
Losers' Club,"Kaan and Mete, co-hosts of a mid 1990s radio show called Kaybedenler Kulübü (Losers' Club), struggle to deal with their daily lives after their show becomes an instant hit. Kaan meets Zeynep, the girl of his dreams, but their relationship comes under pressure as the show continues to stir controversy and attract fans from every segment of Istanbul society.",2011-03-25,6.6,127,"Comedy, Drama",tr
The Dictator,The heroic story of a dictator who risks his life to ensure that democracy would never come to the country he so lovingly oppressed.,2012-05-15,6.195,5873,Comedy,en
BlacKkKlansman,"Colorado Springs, late 1970s. Ron Stallworth, an African American police officer, and Flip Zimmerman, his Jewish colleague, run an undercover operation to infiltrate the Ku Klux Klan.",2018-08-09,7.5,7527,"Crime, Comedy, Drama",en
,"A group of unique characters from dramatically different socio-cultural backgrounds meet in startling circumstances in the vibrant and colorful city of Istanbul, some by chance and some by force of will.",,7.7,111,"Drama, Mystery",tr
Love Likes Coincidences,"Year 1977, a September morning in Ankara... Yilmaz tries to rush his pregnant wife Neriman to the hospital and he crushes into Omer's car. This accident causes Omer's pregnant wife Inci, who was in the back seat, to have a pre-term labor. The babies are born on the same day. They see each other for the first time... This accident is the threshold of the coincidences that bring Ozgur and Deniz together.",2011-02-04,6.9,92,"Drama, Romance",tr
,Undercover agents infiltrate a drug kingpin's operation by posing as a couple at the campground where he spends his weekends. Inspired by real events.,,7.5,145,"Crime, Drama",nl
,"Historian Bettany Hughes travels to India, Greece and China on the trail of three giants of ancient philosophy - Buddha, Socrates and Confucius.",,6.636,11,Documentary,en
,"Three people's fates are interwoven in the Battle of the Teutoburg Forest in 9 A.D., during which Germanic warriors halt the spread of the Roman Empire.",,7.3,594,"Unknown, Drama",de
,"After seeing an ad for a midwife, a recently divorced big-city nurse moves to the redwood forests of California, where she meets an intriguing man.",,7.991,526,Drama,en
,,,6.0,8,"Drama, Mystery",es
,"In 2008, a fight over land in a seaside town near Rome spirals into a deadly battle between organized crime, corrupt politicians and the Vatican.",,7.4,200,"Crime, Drama",it
,"Follow the voyages of Starfleet on their missions to discover new worlds and new life forms, and one Starfleet officer who must learn that to truly understand all things alien, you must first understand yourself.",,7.089,1795,"Unknown, Unknown, Drama",en
,"While hunting for a dating-site predator, an underused cop discovers a husband and wife with a horrific secret — and a web of conspiracy hiding it.",,7.2,99,"Drama, Crime",pt
,"Wielding a light-up sword through the dark corners of a high school, a nurse with an unusual gift protects students from monsters only she can see.",,7.4,112,"Unknown, Drama",ko
,"In 1980s LA, a crew of misfits reinvent themselves as the Gorgeous Ladies of Wrestling.",,7.268,380,"Comedy, Drama",en
Amanda Knox,"This gripping, atmospheric documentary recounts the infamous trial, conviction and eventual acquittal of Seattle native Amanda Knox for the 2007 murder of a British exchange student in Italy.",2016-09-10,6.629,550,"Documentary, Crime",en
,"100 years in the future, when the Earth has been abandoned due to radioactivity, the last surviving humans live on an ark orbiting the planet — but the ark won't last forever. So the repressive regime picks 100 expendable juvenile delinquents to send down to Earth to see if the planet is still habitable.",,7.897,8151,"Unknown, Drama, Unknown",en
Enola Holmes,"While searching for her missing mother, intrepid teen Enola Holmes uses her sleuthing skills to outsmart big brother Sherlock and help a runaway lord.",2020-09-23,7.265,6049,"Adventure, Mystery, Crime",en
,"An origins story, beginning in 1947, which follows Ratched's journey and evolution from nurse to full-fledged monster tracking her murderous progression through the mental health care system.",,7.684,1127,"Mystery, Drama, Crime",en
The Social Dilemma,"This documentary-drama hybrid explores the dangerous human impact of social networking, with tech experts sounding the alarm on their own creations.",2020-01-26,7.5,1601,"Documentary, Drama",en
,"Elegant, proper Grace and freewheeling, eccentric Frankie are a pair of frenemies whose lives are turned upside down - and permanently intertwined - when their husbands leave them for each other. Together, they must face starting over in their 70s in a 21st century world.",,7.7,314,"Comedy, Drama",en
Seven Pounds,An IRS agent with a fateful secret embarks on an extraordinary journey of redemption by forever changing the lives of seven strangers.,2008-12-18,7.609,6777,Drama,en
,"Armed with technological gear, great ideas and an unfailing sense of humour, Talking Tom and his friends are on a mission to reach stardom at all costs.",,7.1,15,"Animation, Comedy, Unknown",en
,"An unusual, real-world romance involving relatable people, with one catch - there are three of them! You Me Her infuses the sensibilities of a smart, grounded indie rom-com with a distinctive twist: one of the two parties just happens to be a suburban married couple.",,7.011,408,"Comedy, Drama",en
,"After wealthy college boy Ömer and lower class college girl Aysem fall in love and quickly marry, they learn that love and life aren't always perfect.",,6.5,2,"Comedy, Drama, Family",tr
Zengo,"A housewife with a big passion for fashion and with the help of her tailor Fazilet, she is turning her ideas into reality, but she gets competition from her school day friend and rival Menkibe.",2020-03-06,2.0,5,Comedy,tr
Pocket Hercules: Naim Suleymanoglu,"From defecting to the Olympics, an underdog weightlifter powers through adversity to raise up his community in this biopic of Naim Süleymanoğlu.",2019-11-22,7.7,66,Drama,tr
Vendors' Meeting,"How much chaos can three white goods dealers who come to İstanbul from Anatolia get into in three days? The paths of Namık, Adem and Sadık, three men going through difficult periods in their lives, intersect at a dealer meeting. After a series of unexpected events, they find themselves caught in a crazy plan. To survive, the three dealers have no choice but trust each other and move fast.",2020-02-20,5.1,41,Comedy,tr
