title,overview,release_date,vote_average,vote_count,genres,original_language
Lost in Translation,"Two lost souls visiting Tokyo -- the young, neglected wife of a photographer and a washed-up movie star shooting a TV commercial -- find an odd solace and pensive freedom to be real in each other's company, away from their lives in America.",2003-09-18,7.4,7361,"Drama, Romance",en
Marriage Story,"A stage director and an actress struggle through a grueling, coast-to-coast divorce that pushes them to their personal extremes.",2019-09-28,7.7,6944,Drama,en
,"An aging actor, who long ago enjoyed a brush with fame, makes his living as an acting coach.",,7.5,284,"Comedy, Drama",en
,"Set in a ruined medieval city called Dreamland, Disenchantment follows the grubby adventures of a hard-drinking princess, her feisty elf companion and her personal demon.",,7.4,1112,"Animation, Comedy, Unknown, Unknown",en
,"A drama about the investigations of AC-12, a controversial police anticorruption unit.",,8.265,406,"Crime, Drama, Mystery",en
Lady Bird,"Lady Bird McPherson, a strong willed, deeply opinionated, artistic 17 year old comes of age in Sacramento. Her relationship with her mother and her upbringing are questioned and tested as she plans to head off to college.",2017-09-01,7.3,8531,"Drama, Comedy",en
,"Crank up the 8-track and flash back to a time when platform shoes and puka shells were all the rage in this hilarious retro-sitcom. For Eric, Kelso, Jackie, Hyde, Donna and Fez, a group of high school teens who spend most of their time hanging out in Eric’s basement, life in the ‘70s isn’t always so groovy. But between trying to figure out the meaning of life, avoiding their parents, and dealing with out-of-control hormones, they’ve learned one thing for sure: they’ll always get by with a little help from their friends.",,8.0,1418,"Comedy, Family, Drama",en
Kill Me If You Dare,A winning lottery ticket has grave consequences for a married couple when they start hatching plans to kill each other for the prize money.,2024-02-13,5.4,90,"Comedy, Romance",pl
Turkish Ice Cream,"In 1915, two Turks in Australia make a living by selling ice cream. When they hear war has broken out, they decide to go to Çanakkale. Authorities don't let them leave the island, so the two decide to put up a fight in Australia.",2019-03-15,6.0,37,"History, Drama, War",tr
No Way,A Turkish taxi driver tells stories which are almost unbelievable.,2015-09-25,4.9,44,"Comedy, Drama",tr
,"The Sons of Anarchy (SOA) is an outlaw motorcycle club with many charters in the United States as well as overseas. The show focused on the original and founding (mother) charter, Sons of Anarchy Motorcycle Club, Redwood Original, often referred to by the acronym SAMCRO, Sam Crow, or simply Redwood charter. the charter operates both illegal and legal businesses in the small town of Charming. They combine gun-running and a garage, plus involvement in porn film. Clay, the president, likes it old school and violent; while Jax, his stepson and the club's VP, has thoughts about changing the way things are. Their conflict has effects on both the club and their personal relationship. especially When Jackson ""Jax"" Teller discovers that his father had a different view in mind for SAMCRO (Sons of Anarchy Motorcycle Club Redwood Original) he goes on a personal quest to cleanse the name and make the club a better place, but at what cost?",,8.4,2903,"Crime, Drama",en
,"Bored and unhappy as the Lord of Hell, Lucifer Morningstar abandoned his throne and retired to Los Angeles, where he has teamed up with LAPD detective Chloe Decker to take down criminals. But the longer he's away from the underworld, the greater the threat that the worst of humanity could escape.",,8.457,14805,"Crime, Unknown",en
My Travel Buddy 2,Onur and Seref have become both housemates and colleagues within a year. Seref is not successful in managing the song career of Onur.,2018-10-12,5.7,41,"Comedy, Family",tr
,Step inside the minds of the most innovative designers in a variety of disciplines and learn how design impacts every aspect of life.,,7.7,68,Documentary,en
,"Centered around a personally troubled, officially discredited police chief and his inharmonious police team in Ankara Police Force. Even though the show usually focuses on murders and other crimes that happens on a weekly basis, the undertone of the story leads to an eventual duel between Behzat Ç. and the rotten department officials and bureaucrats.",,7.7,72,"Drama, Unknown, Unknown, Crime",tr
,Follow the booze-fueled misadventures of three longtime pals and petty serial criminals who run scams from their Nova Scotia trailer park.,,7.8,258,Comedy,en
,"In the 1960s, Israeli clerk-turned-secret agent Eli Cohen goes deep undercover inside Syria on a perilous, years-long mission to spy for Mossad.",,7.4,248,Drama,en
Eyyvah Eyvah 3,Thid part of the popular turkish comedy film series.,2014-01-31,5.288,59,Comedy,tr
Midnight in Paris,"While on a trip to Paris with his fiancée's family, a nostalgic screenwriter finds himself mysteriously going back to the 1920s every day at midnight.",2011-05-11,7.5,7281,"Fantasy, Comedy, Romance",en
,"Classic Saturday-morning cartoon series featuring magical blue elf-like creatures called Smurfs. The Smurfs, named for their personalities, inhabit a village of mushroom houses in an enchanted forest. These loveable creatures are led by Papa Smurf and live carefree... except for one major threat to their existance: Gargamel, an evil but inept wizard who lives in a stone-built house in the forest; and his feline companion, the equally nasty Azrael. ",,6.9,489,"Animation, Family, Unknown, Unknown, Comedy",en
Butterflies,"Three strangers with one thing in common — the same father — come to a Turkish village to bury him, and learn about him and each other.",2018-03-30,7.0,98,"Drama, Comedy",tr
Cem Yılmaz: CM101MMXI Fundamentals,"The funny little details of everyday life,  simple things that make us laugh.  An unforgettable performance from Cem Yilmaz.  Yilmaz captures the audience with his hilarious stories about relationships, humankind's struggle with the technology and professional life. Yilmaz proves us that a food delivery or even a funeral might be amusing when considered correctly.  Written by Elmalma Brand Communication",2013-01-02,8.2,126,"Comedy, TV Movie, Documentary",tr
Inception,"Cobb, a skilled thief who commits corporate espionage by infiltrating the subconscious of his targets is offered a chance to regain his old life as payment for a task considered to be impossible: ""inception"", the implantation of another person's idea into a target's subconscious.",2010-07-15,8.37,36819,"Action, Science Fiction, Adventure",en
A.R.O.G,Commander Logar fools Arif and sends him 1.000.000 years back in the time. He must civilize people from past to reach today.,2008-12-05,6.967,243,"Science Fiction, Fantasy, Comedy",tr
,"Ömer, a young man returning from military service, is set up by his friends and fiancé and ends up in prison for ten years. He fakes his own death and manages to escape. He re-creates himself as ‘Ezel’, a high-end gambler who is outwardly a successful man, but inwardly driven by one thing - his determination to understand why the people he loved betrayed him, and take his revenge.",,8.3,80,"Crime, Drama, Unknown",tr
Love Story,"Harvard Law student Oliver Barrett IV and music student Jennifer Cavilleri share a chemistry they cannot deny - and a love they cannot ignore. Despite their opposite backgrounds, the young couple put their hearts on the line for each other. When they marry, Oliver's wealthy father threatens to disown him. Jenny tries to reconcile the Barrett men, but to no avail.",1970-12-16,6.8,689,"Romance, Drama",en
Wedding Association 2: Circumcision,Ismail and his old screwball crew land themselves in hot water when his grandson's circumcision evolves into a buzz-making citywide event.,2015-12-04,5.957,93,Comedy,tr
Alone,"A recently widowed traveler is kidnapped by a cold blooded killer, only to escape into the wilderness where she is forced to battle against the elements as her pursuer closes in on her.",2020-09-10,6.3,735,"Thriller, Horror",en
Reservoir Dogs,"A botched robbery indicates a police informant, and the pressure mounts in the aftermath at a warehouse. Crime begets violence as the survivors -- veteran Mr. White, newcomer Mr. Orange, psychopathic parolee Mr. Blonde, bickering weasel Mr. Pink and Nice Guy Eddie -- unravel.",1992-09-02,8.1,14353,"Crime, Thriller",en
,"Historian Bettany Hughes retraces the lives of three great thinkers whose ideas shaped the modern world - Karl Marx, Frederick Nietzsche and Sigmund Freud.",,7.3,9,Documentary,en
White Girl,"Beth, a thirteen-year-old white girl, is seemingly lost. She wanders around east London, seeking out help from strangers. But over the course of an evening, her interactions with the city's dwellers take darker turns. Terror appears to lie around every corner.",2019-10-06,4.7,6,Horror,en
Amar,"Five stories blend with love, sex, the emptiness of being unloved, passion and desire: Carlos and Susana go to some uncle´s apartment to make love. Meanwhile, Benito, an 80-year-old, performs a serenade to his wife. His neighbor Adela is told that her mother has Alzheimer and that she will be relocated since the Buenos Aires building she lives in will be demolished. Amado catches his son Carlos stealing his money. Gabriel asks Martha´s parents for her hand in marriage but they condition them to get married at their favorite church. And Patricia, 40, a creative agent, sexually abuses Joel, who directs a beer commercial.",2009-02-27,4.3,10,"Comedy, Drama, Romance",es
Shaft,"JJ, aka John Shaft Jr., may be a cyber security expert with a degree from MIT, but to uncover the truth behind his best friend’s untimely death, he needs an education only his dad can provide. Absent throughout JJ’s youth, the legendary locked-and-loaded John Shaft agrees to help his progeny navigate Harlem’s heroin-infested underbelly.",2019-06-14,6.532,1715,"Action, Crime",en
The Twilight Saga: Breaking Dawn - Part 2,"After the birth of Renesmee, the Cullens gather other vampire clans in order to protect the child from a false allegation that puts the family in front of the Volturi.",2012-11-13,6.461,8902,"Adventure, Fantasy, Drama, Romance",en
The Perfect Date,"No beau? No problem! To earn money for college, a high schooler creates a dating app that lets him act as a stand-in boyfriend.",2019-04-12,6.454,3243,"Romance, Comedy",en
Alex Strangelove,"Alex Truelove is on a quest to lose his virginity, an event eagerly awaited by his patient girlfriend and cheered on with welcome advice by his rowdy friends. But Alex, a super gregarious dude, is oddly unmotivated. A magical house party throws Alex into the presence of Elliot, a hunky college guy, who pegs Alex as gay and flirts hard. Alex is taken aback but after a series of setbacks on the girlfriend front he takes the plunge and learns some interesting new facts about himself.",2018-04-16,6.573,1533,"Comedy, Drama",en
,"After a brutal virus wipes out most of the population, two young siblings embark on a perilous search for safety. A Scandinavian thriller series.",,7.301,1196,"Unknown, Drama",da
John Wick: Chapter 2,"John Wick is forced out of retirement by a former associate looking to seize control of a shadowy international assassins’ guild. Bound by a blood oath to aid him, Wick travels to Rome and does battle against some of the world’s most dangerous killers.",2017-02-08,7.333,13123,"Action, Thriller, Crime",en
The Revenant,"In the 1820s, a frontiersman, Hugh Glass, sets out on a path of vengeance against those who left him for dead after a bear mauling.",2015-12-25,7.5,18140,"Western, Drama, Adventure",en
A Clockwork Orange,"In a near-future Britain, young Alexander DeLarge and his pals get their kicks beating and raping anyone they please. When not destroying the lives of others, Alex swoons to the music of Beethoven. The state, eager to crack down on juvenile crime, gives an incarcerated Alex the option to undergo an invasive procedure that'll rob him of all personal agency. In a time when conscience is a commodity, can Alex change his tune?",1971-12-19,8.192,12914,"Science Fiction, Crime",en
,"A gangster family epic set in 1919 Birmingham, England and centered on a gang who sew razor blades in the peaks of their caps, and their fierce boss Tommy Shelby, who means to move up in the world.",,8.535,10085,"Drama, Crime",en
The Other Boleyn Girl,"A sumptuous and sensual tale of intrigue, romance and betrayal set against the backdrop of a defining moment in European history: two beautiful sisters, Anne and Mary Boleyn, driven by their family's blind ambition, compete for the love of the handsome and passionate King Henry VIII.",2008-02-28,6.7,2052,"Drama, Romance, History",en
Secret Window,"Mort Rainey, a writer just emerging from a painful divorce with his ex-wife, is stalked at his remote lake house by a psychotic stranger and would-be scribe who claims Rainey swiped his best story idea. But as Rainey endeavors to prove his innocence, he begins to question his own sanity.",2004-03-12,6.572,3619,"Mystery, Thriller",en
,Embark on a global cultural journey into street food and discover the stories of the people who create the flavorful dishes.,,7.5,34,Documentary,en
,A new caretaker moves with his family into the mysterious Overlook Hotel for the winter.,,6.31,310,"Unknown, Drama",en
"Extremely Wicked, Shockingly Evil and Vile","A chronicle of the crimes of Ted Bundy, from the perspective of his longtime girlfriend, Elizabeth Kloepfer, who refused to believe the truth about him for years.",2019-05-02,7.0,3344,"Drama, Crime",en
One Flew Over the Cuckoo's Nest,"A petty criminal fakes insanity to serve his sentence in a mental ward rather than prison. He soon finds himself as a leader to the other patients—and an enemy to the cruel, domineering nurse who runs the ward.",1975-11-19,8.414,10513,Drama,en
Fifty Shades Darker,"When a wounded Christian Grey tries to entice a cautious Ana Steele back into his life, she demands a new arrangement before she will give him another chance. As the two begin to build trust and find stability, shadowy figures from Christian’s past start to circle the couple, determined to destroy their hopes for a future together.",2017-02-08,6.482,7627,"Drama, Romance",en
,"In Paris of the near future, a dating app matches singles with their soul mates by mining their brain data. But decoding true love comes at a price.",,5.662,65,"Unknown, Drama",fr
,This documentary series tackles one of history's most horrifying subjects: the Holocaust and the infamous Auschwitz-Birkenau concentration camp.,,7.5,179,"Documentary, Crime, Unknown",en
Gone Girl,"With his wife's disappearance having become the focus of an intense media circus, a man sees the spotlight turned on him when it's suspected that he may not be innocent.",2014-10-01,7.892,18691,"Mystery, Thriller, Drama",en
Isn't It Romantic,"For a long time, Natalie, an Australian architect living in New York City, had always believed that what she had seen in rom-coms is all fantasy. But after thwarting a mugger at a subway station only to be knocked out while fleeing, Natalie wakes up and discovers that her life has suddenly become her worst nightmare—a romantic comedy—and she is the leading lady.",2019-02-13,6.213,3466,"Comedy, Fantasy, Romance",en
,"When a singer is found murdered, with her scent glands excised from her body, detectives probe a group of friends who attended boarding school with her.",,6.9,334,Crime,de
Pirates of the Caribbean: Dead Man's Chest,Captain Jack Sparrow works his way out of a blood debt with the ghostly Davy Jones to avoid eternal damnation.,2006-07-06,7.365,16026,"Adventure, Fantasy, Action",en
Bugsy,"New York gangster Ben 'Bugsy' Siegel takes a brief business trip to Los Angeles. A sharp-dressing womanizer with a foul temper, Siegel doesn't hesitate to kill or maim anyone crossing him. In L.A. the life, the movies, and most of all strong-willed Virginia Hill detain him while his family wait back home. Then a trip to a run-down gambling joint at a spot in the desert known as Las Vegas gives him his big idea.",1991-12-10,6.362,388,"Crime, Drama, Mystery",en
The Angel,"True story of Ashraf Marwan, who was President Nasser's son-in-law and special adviser and confidant to his successor Anwar Sadat - while simultaneously Israeli Intelligence's most precious asset of the 20th century. Based on NYT bestselling book 'The Angel: The Egyptian Spy Who Saved Israel' by Uri Bar-Joseph.",2018-05-15,6.6,302,"Action, Drama, History, Thriller, War",en
The Resistance Banker,"In the occupied Netherlands during World War II, banker Walraven van Hall is asked to use his financial contacts to help the Dutch resistance. With his brother Gijs, he comes up with a risky plan to take out huge loans and use the money to finance the Resistance.",2018-03-08,6.698,243,"War, Drama",nl
The Little Mermaid,"The youngest of King Triton’s daughters, and the most defiant, Ariel longs to find out more about the world beyond the sea, and while visiting the surface, falls for the dashing Prince Eric. With mermaids forbidden to interact with humans, Ariel makes a deal with the evil sea witch, Ursula, which gives her a chance to experience life on land, but ultimately places her life – and her father’s crown – in jeopardy.",2023-05-18,6.335,2959,"Adventure, Family, Fantasy, Romance",en
The Tree of Blood,"Marc and Rebeca, a young couple, travel to an old country house that used to belong to their family. Once there, they write the shared history of their roots, creating a huge family tree that harbours relationships of love, heartbreak, sex, madness, jealousy and infidelity, and under which also lies a history laden with secrets.",2018-10-31,6.442,146,Drama,es
,Anthology series in which each season is based on a true crime story featuring an epic tale of love gone wrong.,,6.794,109,"Drama, Crime",en
Velvet Buzzsaw,"Big money artists and mega-collectors pay a high price when art collides with commerce. After a series of paintings by an unknown artist are discovered, a supernatural force enacts revenge on those who have allowed their greed to get in the way of art.",2019-02-01,5.364,1887,"Thriller, Mystery, Horror",en
Suburra,"A gangster known as ""Samurai"" wants to turn the waterfront of Rome into a new Las Vegas. All the local mob bosses have agreed to work for this common goal. But peace is not to last long.",2015-10-14,7.3,1257,"Crime, Drama, Thriller",it
,"From baffling people on the street to orchestrating elaborate tricks, Justin Willman blends good-natured magic with grown-up laughs.",,6.387,53,"Comedy, Unknown",en
The Five-Year Engagement,"Exactly one year after Tom meets Violet, he surprises her with a wedding ring. By all accounts, Tom and Violet are destined for their happily ever after. However, this engaged couple just keep getting tripped up on the long walk down the aisle.",2012-04-27,5.842,1320,"Comedy, Romance",en
,"A young 17th-century witch time travels to the future to save the man she loves, but first must adjust to present-day Cartagena and defeat a dark rival.",,7.1,136,"Unknown, Drama",es
,Nadia keeps dying and reliving her 36th birthday party. She's trapped in a surreal time loop -- and staring down the barrel of her own mortality.,,7.383,830,"Comedy, Drama",en
Back to the Future,"Eighties teenager Marty McFly is accidentally sent back in time to 1955, inadvertently disrupting his parents' first meeting and attracting his mother's romantic interest. Marty must repair the damage to history by rekindling his parents' romance and - with the help of his eccentric inventor friend Doc Brown - return to 1985.",1985-07-03,8.318,20080,"Adventure, Comedy, Science Fiction",en
,"Hundreds of years from now, the last surviving humans discover the means of sending consciousness back through time, directly into people in the 21st century. These ""travelers"" assume the lives of seemingly random people, while secretly working as teams to perform missions in order to save humanity from a terrible future.",,7.6,741,"Drama, Unknown",en
Scent of a Woman,"Charlie Simms is a student at a private preparatory school who comes from a poor family. To earn the money for his flight home to Gresham, Oregon for Christmas, Charlie takes a job over Thanksgiving looking after retired U.S. Army officer Lieutenant Colonel Frank Slade, a cantankerous middle-aged man who lives with his niece and her family.",1992-12-23,7.791,3418,"Drama, Comedy",en
,Inexperienced Otis channels his sex therapist mom when he teams up with rebellious Maeve to set up an underground sex therapy clinic at school.,,8.246,7321,"Comedy, Drama",en
Polar,"When a retiring assassin realizes that he is the target of a hit, he winds up back in the game going head to head with a gang of younger, ruthless killers.",2019-01-25,6.3,2208,"Action, Crime, Drama",en
La La Land,"Mia, an aspiring actress, serves lattes to movie stars in between auditions and Sebastian, a jazz musician, scrapes by playing cocktail party gigs in dingy bars, but as success mounts they are faced with decisions that begin to fray the fragile fabric of their love affair, and the dreams they worked so hard to maintain in each other threaten to rip them apart.",2016-11-29,7.9,16950,"Comedy, Drama, Romance, Music",en
,"Surviving power struggles, betrayals and plots, Hitler's inner circle of Nazi leaders seizes control of Germany and designs its disastrous future.",,6.966,58,"Documentary, Unknown",en
,"A dangerously charming, intensely obsessive young man goes to extreme measures to insert himself into the lives of those he is transfixed by.",,8.0,3219,Drama,en
Bird Box,"Five years after an ominous unseen presence drives most of society to suicide, a survivor and her two children make a desperate bid to reach safety.",2018-12-13,6.833,9946,"Horror, Thriller, Drama",en
Rocco,"Rocco Siffredi is to pornography what Mike Tyson is to boxing or Mick Jagger is to rock’n’roll: a living legend. His mother wanted him to be a priest; with her blessing he became a hardcore performer, devoting his life to one God only: Desire. Rocco Siffredi reveals all, even if it sometimes means busting his own myth: his true story, beginnings, career, wife and children… and the ultimate revelation that will change his life forever.",2016-11-30,5.576,170,Documentary,fr
,"Ex-con Cal McTeer's return to her hometown of Orphelin Bay blows the lid off a generations-long conspiracy of silence around murder, drugs and Sirens.",,6.578,102,"Drama, Crime, Unknown",en
,"A mysterious criminal steals a secret state-of-the-art time machine, intent on destroying America as we know it by changing the past. Our only hope is an unexpected team: a scientist, a soldier and a history professor, who must use the machine's prototype to travel back in time to critical events. While they must make every effort not to affect the past themselves, they must also stay one step ahead of this dangerous fugitive. But can this handpicked team uncover the mystery behind it all and end his destruction before it's too late?",,7.222,709,"Drama, Unknown, Unknown",en
,A troubled war veteran is assigned to protect a controversial politician who may be the target of a terror plot.,,7.8,906,"Crime, Drama, Unknown",en
,"Gloria Sheppard is an intuitive LAPD homicide detective who juggles her demanding personal and professional lives while raising two sons with the help of her troubled younger brother, Davey.",,8.0,11,"Drama, Crime",en
Mean Girls,"Cady Heron is a hit with The Plastics, the A-list girl clique at her new school, until she makes the mistake of falling for Aaron Samuels, the ex-boyfriend of alpha Plastic Regina George.",2004-04-30,7.2,8819,"Drama, Comedy",en
,"Fed up with their families and classmates, two teen girls from a wealthy part of Rome are drawn to the city's underworld and start leading double lives.",,7.898,851,Drama,it
Narcos,Three drug traffickers become worried when the realize they may have outlived their usefulness to their boss.,1992-05-21,7.7,14,Drama,it
,"The provocative story of Cole, a time traveler from a decimated future in a high-stakes race against the clock. Utilizing a dangerous and untested method of time travel, he journeys from 2043 to the present day on a mission to locate and eradicate the source of a deadly plague that will all but annihilate the human race.",,7.4,1069,"Unknown, Drama",en
,Team of chefs vie to impress some of the world's toughest palates as they whip up iconic dishes from different nations in this fast-paced competition.,,6.548,31,Unknown,en
,"The Crains, a fractured family, confront haunting memories of their old home and the terrifying events that drove them from it.",,8.1,2325,"Mystery, Drama",en
,Meet culinary stars around the world who are redefining gourmet food with innovative dishes and tantalizing desserts.,,7.8,108,Documentary,en
,A modern update finds the famous sleuth and his doctor partner solving crime in 21st century London.,,8.5,5513,"Crime, Drama, Mystery",en
Nick and Norah's Infinite Playlist,"Nick cannot stop obsessing over his ex-girlfriend, Tris, until Tris' friend Norah suddenly shows interest in him at a club. Thus begins an odd night filled with ups and downs as the two keep running into Tris and her new boyfriend while searching for Norah's drunken friend, Caroline, with help from Nick's band mates. As the night winds down, the two have to figure out what they want from each other.",2008-10-03,6.448,1183,"Comedy, Music, Drama, Romance",en
Ghost,"After a young man is murdered, his spirit stays behind to warn his lover of impending danger, with the help of a reluctant psychic.",1990-07-13,7.22,5561,"Fantasy, Drama, Thriller, Mystery, Romance",en
