title,overview,release_date,vote_average,vote_count,genres,original_language
,"Talented designers from around the world compete for $250,000 and the chance to become the next big thing in fashion.",,6.8,38,Unknown,en
Maid in Manhattan,A Tubi original remake of the 2002 Jennifer Lopez feature.,,0.0,0,"Comedy, Romance, Drama",en
Capernaum,"After running away from his negligent parents, committing a violent crime and being sentenced to five years in jail, a hardened, streetwise 12-year-old Lebanese boy sues his parents in protest of the life they have given him.",2018-09-20,8.2,1718,Drama,ar
,Landmark mockumentary-maker Philomena Cunk traces the history of Britain and Earth.,,7.9,108,"Comedy, Documentary",en
,"Angsty and awkward fifteen year old Ginny Miller often feels more mature than her thirty year old mother, the irresistible and dynamic Georgia Miller. After years on the run, Georgia desperately wants to put down roots in picturesque New England and give her family something they've never had... a normal life. But it's not all carpool and Kombucha as Georgia's past threatens her and her family's new way of life... and Georgia will do anything to protect her family.",,8.092,1578,"Comedy, Drama",en
Love & Gelato,"Lina is about to graduate high school and has her sights set on her future at MIT. But when her mom gets sick, she encourages Lina to follow in her footsteps and have “the summer of a lifetime” in Rome. Using her mom’s old diary as a guide, she explores the romantic and magical city, where she just might find love... and gelato, of course.",2022-06-22,5.4,222,"Romance, Comedy, Drama",en
,"A financial adviser drags his family from Chicago to the Missouri Ozarks, where he must launder $500 million in five years to appease a drug boss.",,8.2,2337,"Crime, Drama",en
,"In this fantasy drama series, a lonely young woman finds her soul mate and discovers they are both part of an ancient legend.",,6.9,70,"Drama, Unknown, Mystery, Unknown",tr
Knives Out,"When renowned crime novelist Harlan Thrombey is found dead at his estate just after his 85th birthday, the inquisitive and debonair Detective Benoit Blanc is mysteriously enlisted to investigate. From Harlan's dysfunctional family to his devoted staff, Blanc sifts through a web of red herrings and self-serving lies to uncover the truth behind Harlan's untimely death.",2019-11-27,7.8,12487,"Comedy, Crime, Mystery",en
Me Before You,"A small town girl is caught between dead-end jobs. A high-profile, successful man becomes wheelchair bound following an accident. The man decides his life is not worth living until the girl is hired for six months to be his new caretaker. Worlds apart and trapped together by circumstance, the two get off to a rocky start. But the girl becomes determined to prove to the man that life is worth living and as they embark on a series of adventures together, each finds their world changing in ways neither of them could begin to imagine.",2016-06-01,7.929,12440,"Drama, Romance",en
,"Wednesday Addams is sent to Nevermore Academy, a bizarre boarding school where she attempts to master her psychic powers, stop a monstrous killing spree of the town citizens, and solve the supernatural mystery that affected her family 25 years ago — all while navigating her new relationships.",,8.4,8771,"Unknown, Mystery, Comedy",en
,Passengers on an immigrant ship traveling to the new continent get caught in a mysterious riddle when they find a second vessel adrift on the open sea.,,7.6,1270,"Mystery, Drama",de
,"Following the success in the Camelot Singularity, Ritsuka Fujimaru and Mash Kyrielight are assigned to the last Singularity in the Grand Order initiative. In Ancient Babylonia, 2500 BCE, they embark on a mission to secure humanity's survival. Upon arrival, they learn that three gods have threatened Uruk, the Babylonian city ruled by King Gilgamesh. Ritsuka and Mash must work together to fend off the invasion of mysterious beasts in Uruk under Gilgamesh's orders while investigating the true nature of the three gods' actions against humanity; but unknown to Ritsuka, an ancient entity is slowly rising from its slumber.",,7.9,189,"Animation, Unknown, Drama, Unknown",ja
Love in the Villa,"A young woman takes a trip to romantic Verona, Italy, after a breakup, only to find that the villa she reserved was double-booked, and she'll have to share her vacation with a cynical British man.",2022-09-01,6.043,359,"Romance, Comedy",en
The Lost Daughter,A woman's seaside vacation takes a dark turn when her obsession with a young mother forces her to confront secrets from her past.,2021-12-15,6.535,965,Drama,en
,"A terminally ill French secret service agent is hired by Hydra, a mysterious black ops organization set up by the government, to fight crime by any means necessary and receive experimental treatment in return. Also, his daughter hates him.",,6.9,18,"Unknown, Comedy, Drama",fr
,"A sexy, suspense-driven legal thriller about a group of ambitious law students and their brilliant, mysterious criminal defense professor. They become entangled in a murder plot and will shake the entire university and change the course of their lives.",,7.9,1616,"Crime, Drama, Mystery",en
,"A single-camera ensemble comedy following the lives of an eclectic group of detectives in a New York precinct, including one slacker who is forced to shape up when he gets a new boss.",,8.2,3401,"Comedy, Crime",en
Sully,"On 15 January 2009, the world witnessed the 'Miracle on the Hudson' when Captain 'Sully' Sullenberger glided his disabled plane onto the Hudson River, saving the lives of all 155 souls aboard. However, even as Sully was being heralded by the public and the media for his unprecedented feat of aviation skill, an investigation was unfolding that threatened to destroy his reputation and career.",2016-09-07,7.2,7195,"Drama, History",en
,"Legendary manager Fatih Terim recounts his football journey, from his playing days to coaching and leading several teams to championship glory.",,7.2,11,Documentary,tr
,"An intimate, hilarious, touching and almost voyeur look at the everyday realities of married life and differences between men and women.",,8.2,17,Comedy,tr
Nocturnal Animals,"Susan Morrow receives a book manuscript from her ex-husband – a man she left 20 years earlier – asking for her opinion of his writing. As she reads, she is drawn into the fictional life of Tony Hastings, a mathematics professor whose family vacation turns violent.",2016-11-04,7.424,7810,"Drama, Thriller",en
The Gentlemen,"American expat Mickey Pearson has built a highly profitable marijuana empire in London. When word gets out that he’s looking to cash out of the business forever it triggers plots, schemes, bribery and blackmail in an attempt to steal his domain out from under him.",2020-01-01,7.68,5875,"Action, Crime, Comedy",en
Mona Lisa Smile,"Katherine Watson is a recent UCLA graduate hired to teach art history at the prestigious all-female Wellesley College, in 1953. Determined to confront the outdated mores of society and the institution that embraces them, Katherine inspires her traditional students, including Betty and Joan, to challenge the lives they are expected to lead.",2003-12-19,6.9,1734,"Drama, History, Romance",en
,"The everyday lives of office employees in the Scranton, Pennsylvania branch of the fictional Dunder Mifflin Paper Company.",,8.6,4273,Comedy,en
Anna Karenina,"In Imperial Russia, Anna, the wife of the officer Karenin, goes to Moscow to visit her brother. On the way, she meets the charming cavalry officer Vronsky to whom she is immediately attracted. But in St. Petersburg’s high society, a relationship like this could destroy a woman’s reputation.",2012-09-06,6.719,2276,"Drama, Romance, History",en
Persuasion,"Living with her snobby family on the brink of bankruptcy, Anne Elliot is an unconforming woman with modern sensibilities. When Frederick Wentworth - the dashing one she once sent away - crashes back into her life, Anne must choose between putting the past behind her or listening to her heart when it comes to second chances.",2022-07-01,6.0,585,"Romance, Drama, Comedy",en
,3 brides running away and falling in love with 3 other hot guys,,6.75,4,Comedy,tr
,"After he's shot in 1968, Andy Warhol begins documenting his life and feelings. Those diaries, and this series, reveal the secrets behind his persona.",,6.711,19,Documentary,en
The Social Network,"In 2003, Harvard undergrad and computer programmer Mark Zuckerberg begins work on a new concept that eventually turns into the global social network known as Facebook. Six years later, Mark is one of the youngest billionaires ever, but his unprecedented success leads to both personal and legal complications when he ends up on the receiving end of two lawsuits, one involving his former friend.",2010-10-01,7.4,12156,Drama,en
Husband Factor,A traditional Turkish woman tries to find love and is forced by her family members to get married.,2015-03-20,5.7,47,"Romance, Comedy",tr
,"Eleanor Shellstrop, an ordinary woman who, through an extraordinary string of events, enters the afterlife where she comes to realize that she hasn't been a very good person. With the help of her wise afterlife mentor, she's determined to shed her old way of living and discover the awesome (or at least the pretty good) person within.",,7.974,1624,"Unknown, Comedy",en
Sex and the City,A New York writer on sex and love is finally getting married to her Mr. Big. But her three best girlfriends must console her after one of them inadvertently leads Mr. Big to jilt her.,2008-05-12,6.575,2117,"Comedy, Drama, Romance",en
,"Crime journalist Raphael Rowe goes behind the bars of some of the world’s most notorious and toughest prisons. Immersing himself in maximum security facilities around the world to live as a prisoner, he encounters the inmates locked up for their crimes and meets the men and women on the right side of law tasked with keeping the criminals behind bars.",,7.016,64,"Crime, Documentary",en
,"Powerful cats, indestructible arachnids and flesh-melting pit vipers are just the beginning in this series about Latin America's deadliest creatures.",,6.5,14,Documentary,en
,"Terrifying creatures, wicked surprises and dark comedy converge in this NSFW anthology of animated stories presented by Tim Miller and David Fincher.",,8.258,3354,"Animation, Unknown",en
Friends with Benefits,Dylan is done with relationships. Jamie decides to stop buying into the Hollywood clichés of true love. When the two become friends they decide to try something new and take advantage of their mutual attraction - but without any emotional attachment.,2011-07-21,6.656,7940,"Romance, Comedy",en
The Equalizer 2,"Robert McCall, who serves an unflinching justice for the exploited and oppressed, embarks on a relentless, globe-trotting quest for vengeance when his former partner is murdered.",2018-07-19,6.8,5402,"Action, Thriller, Crime",en
,"When the sun suddenly starts killing everything in its path, passengers on an overnight flight from Brussels attempt to survive by any means necessary.",,7.2,519,Unknown,fr
Britney vs. Spears,Journalist Jenny Eliscu and filmmaker Erin Lee Carr investigate Britney Spears' fight for freedom by way of exclusive interviews and confidential evidence.,2021-09-27,7.021,163,"Documentary, Music",en
Through My Window,"Raquel's longtime crush on her next-door neighbor turns into something more when he starts developing feelings for her, despite his family's objections.",2022-02-04,7.385,3152,"Romance, Drama, Comedy",es
Hustlers,A crew of savvy former strip club employees band together to turn the tables on their Wall Street clients.,2019-09-12,6.473,2925,"Drama, Comedy, Crime",en
Emma.,"In 1800s England, a well-meaning but selfish young woman meddles in the love lives of her friends.",2020-02-13,7.0,1747,"Comedy, Romance",en
How to Lose a Guy in 10 Days,"It's the battle of wills, as Andie needs to prove she can dump a guy in 10 days, whereas Ben needs to prove he can win a girl in 10 days. Now, the clock is ticking—and the wildly entertaining comedy smash is off and running in this irresistible tale of sex, lies and outrageous romantic fireworks!",2003-02-07,6.8,3976,"Comedy, Romance",en
Love Tactics,"An ad executive and a fashion designer-blogger don't believe in love, so they place a bet to make the other fall head over heels - with unusual tactics.",2022-02-11,7.1,306,"Romance, Comedy",tr
,"Set in 2050, Kong becomes a wanted fugitive after wrecking havoc at Alcatraz Island’s Natural History and Marine Preserve. What most humans on the hunt for the formidable animal don’t realize, though, is that Kong was framed by an evil genius who plans to terrorize the world with an army of enormous robotic dinosaurs. As the only beast strong enough to save humanity from the mechanical dinos, Kong must rely on the help of three kids who know the truth about him.",,6.2,16,Animation,en
Maide'nin Altın Günü,"When a meticulous homemaker hosts a lavish get-together, her family heirloom gets stolen. She teams with her out-of-towner nephew to find the thief.",2017-12-08,4.2,20,"Family, Comedy",tr
,"National Security agent Fatima receives a tip that a terrorist attack against Sweden is in the planning stage. Meanwhile Sulle, a teenage girl in Stockholm, gets interested in her student assistant who opens doors to a new and fascinating world - the true path. Kalifat is a thriller about the intermingled fates of five young women who get caught up in the seducing and destroying force of religious fundamentalism.",,7.3,126,"Unknown, Drama",sv
,"Reeling from tragedy, a nondescript house cleaner embarks on a murderous streak as she searches for her missing husband and reckons with old wounds.",,7.1,78,"Crime, Drama",tr
Recep Ivedik 5,"During his visit of condolence to Ismet's funeral, Recep Ivedik feels sorry about Ismet's remaining family members due to his latest unfinished job contract which would cause hard financial situation for the family. Therefore, Recep decides to finish Ismet's last job by replacing himself as a bus driver and to transport group of athletes. Although Recep and his accompanying friend Nurullah were expecting this could be a short trip, they learn that it is not because they have to transport young national athletes to sports organization in a foreign country. This becomes the beginning for them to have irreversible adventure. When they are on the road, unfortunate things happen and crisis appears for the team. Recep, who believes only in victory, takes control of the situation and develops his own methods in order to make the team successful while he face with all funny events.",2017-02-16,4.5,105,Comedy,tr
Venom: The Last Dance,"Eddie and Venom are on the run. Hunted by both of their worlds and with the net closing in, the duo are forced into a devastating decision that will bring the curtains down on Venom and Eddie's last dance.",2024-10-22,6.805,2249,"Action, Science Fiction, Adventure",en
,"When her daughter is abducted, a Norwegian diplomat travels to the Middle East, banking on old friends — and a deep secret — to help free her.",,6.9,54,Drama,no
,"Follows the misadventures of four irreverent grade-schoolers in the quiet, dysfunctional town of South Park, Colorado.",,8.369,4378,"Animation, Comedy",en
,"A dance musical that explores the juxtaposition of several segments of 1980s life and society in New York: the ball culture world, the rise of the luxury Trump-era universe and the downtown social and literary scene.",,8.3,534,Drama,en
,"In cosmopolitan 1950s Istanbul, a mother with a troubled past works at a nightclub to reconnect with and help the rebellious daughter she couldn’t raise.",,7.0,60,Drama,tr
,"When Carlton Flynn vanishes 17 years to the night after Stewart Green did, it sets off a chain reaction in the lives of people connected to both men.",,6.968,220,"Drama, Crime, Mystery",en
The Guilty,A demoted police officer assigned to a call dispatch desk is conflicted when he receives an emergency phone call from a kidnapped woman.,2021-09-24,6.42,2688,"Drama, Thriller",en
,"When family man Nick Brewer is abducted in a crime with a sinister online twist, those closest to him race to uncover who is behind it and why.",,7.174,357,"Drama, Crime, Mystery",en
,"Third-year culinary students Prem, Dynamite and Samsi are intrigued when they find out about a cooking competition with a huge reward that would be perfect for their gang. Prem is losing confidence in his skills as a chef when he meets Ten, a medical student under a heavy burden of stress. Ten approaches Prem to teach him cooking, and Prem wants nothing to do with him until he's in sudden need of a large sum of money. However, as the lessons go on, it isn't just the food that's hot, but also their faces as they slowly fall for each other. Meanwhile, Dynamite is love-struck by Fire, Ten's friend who won't give him the time of day.",,7.3,6,"Comedy, Drama",th
,A father recounts to his children - through a series of flashbacks - the journey he and his four best friends took leading up to him meeting their mother.,,8.2,5039,Comedy,en
Don't Look Up,Two astronomers go on a media tour to warn humankind of a planet-killing comet hurtling toward Earth. The response from a distracted world: Meh.,2021-12-08,7.083,8308,"Comedy, Science Fiction, Drama",en
Arif V 216,"After 8 years, Arif's old friend 216 from planet GORA pays a visit to Earth.Together they go on a quest where they'll be visiting 60's.",2018-01-05,6.3,196,"Adventure, Comedy, Science Fiction",tr
Red Notice,"An Interpol-issued Red Notice is a global alert to hunt and capture the world's most wanted. But when a daring heist brings together the FBI's top profiler and two rival criminals, there's no telling what will happen.",2021-11-04,6.765,5837,"Action, Comedy, Crime",en
What a Crush,"Ferhat is a spoiled man who takes over his father's company. Ferhat's right hand is his childhood friend, the company's finance manager, Gökhan. They are not very kind to their employees. One day they will be friends with the restaurant owner. Ferhat falls in love with the restaurant owner's daughter Elif. But Elif is not a delicate and pure young girl. Her career, her hard character, and her witless intelligence, which are full of special trainings and superior services, will make Ferhat much more difficult.",2018-03-02,5.6,78,Comedy,tr
,"More than seven years after the world has become a frozen wasteland, the remnants of humanity inhabit a gigantic, perpetually-moving train that circles the globe as class warfare, social injustice and the politics of survival play out.",,7.387,1230,"Unknown, Drama",en
,"Over the last ten years, technology has transformed almost every aspect of our lives before we've had time to stop and question it. In every home; on every desk; in every palm - a plasma screen; a monitor; a smartphone - a black mirror of our 21st Century existence.",,8.3,5126,"Unknown, Drama, Mystery",en
,"Ever wonder what's happening inside your head? From dreaming to anxiety disorders, discover how your brain works with this illuminating series.",,7.399,99,Documentary,en
,"Rick is a mentally-unbalanced but scientifically gifted old man who has recently reconnected with his family. He spends most of his time involving his young grandson Morty in dangerous, outlandish adventures throughout space and alternate universes. Compounded with Morty's already unstable family life, these events cause Morty much distress at home and school.",,8.7,9871,"Animation, Comedy, Unknown, Unknown",en
,"We spend it, we borrow it, and save it. Now let's talk about money and its many minefields, from credit cards to casino, scammers to student loans.",,7.346,78,Documentary,en
Lion,"A five-year-old Indian boy gets lost on the streets of Calcutta, thousands of kilometers from home. He survives many challenges before being adopted by a couple in Australia; 25 years later, he sets out to find his lost family.",2016-11-24,8.1,6558,Drama,en
Joker,"During the 1980s, a failed stand-up comedian is driven insane and turns to a life of crime and chaos in Gotham City while becoming an infamous psychopathic crime figure.",2019-10-01,8.1,25944,"Crime, Thriller, Drama",en
Fifty Shades of Grey,"When college senior Anastasia Steele steps in for her sick roommate to interview prominent businessman Christian Grey for their campus paper, little does she realize the path her life will take. Christian, as enigmatic as he is rich and powerful, finds himself strangely drawn to Ana, and she to him. Though sexually inexperienced, Ana plunges headlong into an affair -- and learns that Christian's true sexual proclivities push the boundaries of pain and pleasure.",2015-02-11,5.883,11808,"Drama, Romance, Thriller",en
,"This documentary series, made in partnership with Vox, explain some of the world's current trends, from politics, to science to pop culture.",,7.427,109,Documentary,en
Casino,"In early-1970s Las Vegas, Sam ""Ace"" Rothstein gets tapped by his bosses to head the Tangiers Casino. At first, he's a great success in the job, but over the years, problems with his loose-cannon enforcer Nicky Santoro, his ex-hustler wife Ginger, her con-artist ex Lester Diamond and a handful of corrupt politicians put Sam in ever-increasing danger.",1995-11-22,8.0,5847,"Crime, Drama",en
,The documentary series explores different political figures throughout history.,,7.347,213,"Documentary, Unknown",en
,"The gripping, decades-spanning inside story of Her Majesty Queen Elizabeth II and the Prime Ministers who shaped Britain's post-war destiny. 

The Crown tells the inside story of two of the most famous addresses in the world – Buckingham Palace and 10 Downing Street – and the intrigues, love lives and machinations behind the great events that shaped the second half of the 20th century. Two houses, two courts, one Crown.",,8.2,2103,Drama,en
,"A chronicle of the lives of the aristocratic Crawley family and their servants in the post-Edwardian era—with great events in history having an effect on their lives and on the British social hierarchy.

",,8.1,1014,Drama,en
,A woman's daring sexual past collides with her married-with-kids present when the bad-boy ex she can't stop fantasizing about crashes back into her life.,,7.067,1323,Drama,en
The Lobster,"In a dystopian near future, single people, according to the laws of The City, are taken to The Hotel, where they are obliged to find a romantic partner in forty-five days or are transformed into animals and sent off into The Woods.",2015-10-15,7.0,6245,"Comedy, Drama, Romance",en
Life or Something Like It,"A reporter Lanie Kerrigan interviews a psychic homeless man for a fluff piece about a football game's score. Instead he tells her that her life has no meaning and is going to end in just a few days, which sparks her to action, trying to change the pattern of her life...",2002-04-24,5.7,494,"Comedy, Drama, Romance",en
,"Hundreds of cash-strapped players accept a strange invitation to compete in children's games. Inside, a tempting prize awaits — with deadly high stakes.",,7.8,14826,"Unknown, Mystery, Drama",ko
,"Following her father's murder, a revenge-driven woman puts her trust in a powerful crime boss — and enters the police force under his direction.",,8.2,892,"Crime, Drama, Mystery",ko
Frida,"A biography of artist Frida Kahlo, who channeled the pain of a crippling injury and her tempestuous marriage into her work.",2002-08-29,7.4,2012,"Drama, Romance",en
A Beautiful Mind,"Brilliant mathematician, John Nash, is on the brink of international acclaim when he becomes entangled in a mysterious conspiracy.",2001-12-14,7.858,10231,"Drama, Romance",en
,"To carry out the biggest heist in history, a mysterious man called The Professor recruits a band of eight robbers who have a single characteristic: none of them has anything to lose. Five months of seclusion - memorizing every step, every detail, every probability - culminate in eleven days locked up in the National Coinage and Stamp Factory of Spain, surrounded by police forces and with dozens of hostages in their power, to find out whether their suicide wager will lead to everything or nothing.",,8.242,18687,"Crime, Drama",es
Trouble on Wheels,"After the death of his wife and father, Kudret, who has always lived by the book, decides to go on a road trip to save a girl.",2015-09-18,6.4,80,Comedy,tr
The Sound of Music,"In the years before the Second World War, a tomboyish postulant at an Austrian abbey is hired as a governess in the home of a widowed naval captain with seven children, and brings a new love of life and music into the home.",1965-03-29,7.723,3291,"Drama, Family, Music, Romance",en
My Step Dad: The Hippie,"When three adult siblings meet the offbeat man who their widowed mom fawns over, they take drastic actions to stop them from ever getting married.",2018-04-20,4.9,17,Comedy,tr
,"As Iron Man, teenage child prodigy Tony Stark uses his technological inventions to fight various similarly technologically advanced threats. His friends, James ""Rhodey"" Rhodes and Pepper Potts, help him on his courageous and dangerous adventures.",,7.2,131,"Animation, Unknown, Unknown, Family",en
Godzilla,"Ford Brody, a Navy bomb expert, has just reunited with his family in San Francisco when he is forced to go to Japan to help his estranged father, Joe. Soon, both men are swept up in an escalating crisis when an ancient alpha predator arises from the sea to combat malevolent adversaries that threaten the survival of humanity. The creatures leave colossal destruction in their wake, as they make their way toward their final battleground: San Francisco.",2014-05-14,6.341,9143,"Action, Drama, Science Fiction",en
