title,overview,release_date,vote_average,vote_count,genres,original_language
,"Six young people from New York City, on their own and struggling to survive in the real world, find the companionship, comfort and support they get from each other to be the perfect antidote to the pressures of life.",,8.4,8126,Comedy,en
,"An agnostic sex podcaster and a newly single rabbi fall in love, but can their relationship survive their wildly different lives and meddling families?",,7.569,130,"Comedy, Drama",en
,"Reexamining his own legacy, a renowned figure in erotic cinema decides to branch out and make movies in other genres, from sci-fi to medieval action.",,6.844,61,Comedy,tr
American Factory,"In post-industrial Ohio, a Chinese billionaire opens a new factory in the husk of an abandoned General Motors plant, hiring two thousand blue-collar Americans. Early days of hope and optimism give way to setbacks as high-tech China clashes with working-class America.",2019-08-21,7.2,453,Documentary,en
,"When ambitious Chicago marketing exec Emily unexpectedly lands her dream job in Paris, she embraces a new life as she juggles work, friends and romance.",,7.7,1379,"Drama, Comedy",en
Mortal World 2,"Mortal World 2 tells the story of the Mermer family, who now continues their lives as outlaws, struggles with their own problems. Serhan has difficulty adjusting Begüm, who is pregnant, to their new life. While Serhat is now missing a woman in his life, Gazanfer struggles to keep his family together against the organization. However, Zafer's fall into the hands of the organization turns everyone's lives upside down. Looking for a way to reach Zafer, Gazanfer finds the solution by asking for help from an old friend. This time, the Mermer family will have to make one last heist to reunite with their children.",2023-12-01,6.3,30,"Comedy, Action, Crime",tr
,"At a historic Istanbul hotel, a journalist is unexpectedly thrust into the past and must stop a plot that could change the fate of modern Turkey.",,7.6,58,"Drama, Mystery, Crime",tr
Uglies,"In a futuristic dystopia with enforced beauty standards, a teen awaiting mandatory cosmetic surgery embarks on a journey to find her missing friend.",2024-09-12,5.9,673,"Science Fiction, Adventure, Action",en
Rebel Ridge,A former Marine confronts corruption in a small town when local law enforcement unjustly seizes the bag of cash he needs to post his cousin's bail.,2024-08-27,7.0,1112,"Crime, Action, Thriller, Drama",en
,"Walter White, a New Mexico chemistry teacher, is diagnosed with Stage III cancer and given a prognosis of only two years left to live. He becomes filled with a sense of fearlessness and an unrelenting desire to secure his family's financial future at any cost as he enters the dangerous world of drugs and crime.",,8.918,14811,"Drama, Crime",en
Everything Everywhere All at Once,"An aging Chinese immigrant is swept up in an insane adventure, where she alone can save what's important to her by connecting with the lives she could have led in other universes.",2022-03-24,7.771,6667,"Action, Adventure, Science Fiction",en
Source Code,"When decorated soldier Captain Colter Stevens wakes up in the body of an unknown man, he discovers he's part of a mission to find the bomber of a Chicago commuter train.",2011-03-30,7.305,8351,"Thriller, Science Fiction, Mystery",en
,An exclusive group of privileged teens from a posh prep school on Manhattan's Upper East Side whose lives revolve around the blog of the all-knowing albeit ultra-secretive Gossip Girl.,,8.2,2114,"Drama, Mystery",en
Cem Yılmaz: Diamond Elite Platinum Plus,"In an irreverent but heartfelt stand-up show, Turkish comedian Cem Yılmaz shares stories about childhood, social media and Turks on holiday abroad.",2021-12-31,5.992,63,"Comedy, TV Movie, Documentary",tr
Ricky Gervais: Armageddon,Ricky Gervais dishes out controversial takes on political correctness and oversensitivity in a taboo-busting comedy special about the end of humanity. Recorded at The London Palladium.,2023-12-01,7.2,154,Comedy,en
,"When Clary Fray's mother has disappeared, Clary joins a band of Shadowhunters; demon killing hunters, and gets caught up in a plan to save the world.",,7.557,1085,"Unknown, Drama, Unknown",en
,"The adventures of Ragnar Lothbrok, the greatest hero of his age. The series tells the sagas of Ragnar's band of Viking brothers and his family, as he rises to become King of the Viking tribes. As well as being a fearless warrior, Ragnar embodies the Norse traditions of devotion to the gods. Legend has it that he was a direct descendant of Odin, the god of war and warriors.",,8.097,6987,"Unknown, Drama, Unknown",en
The Book of Eli,"A post-apocalyptic tale, in which a lone man fights his way across America in order to protect a sacred book that holds the secrets to saving humankind.",2010-01-14,6.787,6122,"Action, Thriller, Science Fiction",en
Forrest Gump,"A man with a low IQ has accomplished great things in his life and been present during significant historic events—in each case, far exceeding what anyone imagined he could do. But despite all he has achieved, his one true love eludes him.",1994-06-23,8.469,27654,"Comedy, Drama, Romance",en
Venom: Let There Be Carnage,"After finding a host body in investigative reporter Eddie Brock, the alien symbiote must face a new enemy, Carnage, the alter ego of serial killer Cletus Kasady.",2021-09-30,6.79,10386,"Science Fiction, Action, Adventure",en
,"Set in the charming town of Stars Hollow, Connecticut, the series follows the captivating lives of Lorelai and Rory Gilmore, a mother/daughter pair who have a relationship most people only dream of.",,7.9,1048,"Comedy, Drama",en
,"After a painful breakup, a young lawyer dives head first into the confusing world of modern dating, with the unwavering support of her best friends.",,7.5,30,"Drama, Comedy",tr
Borderless Fog,A big-city detective investigates a series of gruesome murders along the Indonesia-Malaysia border — forcing her to confront ghosts from her past.,2024-07-31,6.3,62,"Thriller, Crime, Mystery, Drama",id
,"A dysfunctional family of superheroes comes together to solve the mystery of their father's death, the threat of the apocalypse and more.",,8.541,9510,"Unknown, Unknown, Drama",en
Suicide Squad,"From DC Comics comes the Suicide Squad, an antihero team of incarcerated supervillains who act as deniable assets for the United States government, undertaking high-risk black ops missions in exchange for commuted prison sentences.",2016-08-03,5.9,21162,"Action, Adventure, Fantasy",en
,"When five ordinary South Londoners discover they have extraordinary powers, it's down to just one man to bring them together to save the woman he loves.",,7.525,178,"Unknown, Unknown, Drama",en
Code 8 Part II,"In a world where superpowered people are heavily policed by robots, an ex-con teams up with a drug lord he despises to protect a teen from a corrupt cop.",2024-02-27,6.387,580,"Science Fiction, Action, Crime",en
,"Three friends arrive in a seaside town, where they connect with their spiritual selves and suddenly face unresolved trauma from their families' pasts.",,7.6,74,Drama,tr
xXx: Return of Xander Cage,"Xander Cage is left for dead after an incident, though he secretly returns to action for a new, tough assignment with his handler Augustus Gibbons.",2017-01-13,6.136,8892,"Action, Adventure, Crime",en
,"Wealth, lust, and betrayal set in the backdrop of Regency era England, seen through the eyes of the powerful Bridgerton family.",,8.1,2861,Drama,en
Brothers,"A reformed criminal's attempt at going straight is derailed when he reunites with his sanity-testing twin brother on a road trip for the score of a lifetime. Dodging bullets, the law, and an overbearing mother along the way, they must heal their severed family bond before they end up killing each other.",2024-10-10,6.007,224,"Action, Comedy, Crime",en
,A writer in a creative and marital crisis finds refuge and support in her three best friends. Based on the novels by Elisabet Benavent.,,7.4,229,"Comedy, Drama",es
Doom of Love,"After his ad agency goes bankrupt, an indebted Fırat falls for a singer at a yoga retreat and joins her on a journey of self-realization.",2022-06-20,6.714,21,"Romance, Drama",tr
Xtreme,"Two years after the murder of his son and father, a retired hitman sets in motion a carefully crafted revenge plan against the killer: his own brother.",2021-06-04,6.3,247,"Action, Adventure, Crime",es
Tau,"Held captive in a futuristic smart house, a woman hopes to escape by befriending the A.I. program that controls the house.",2018-06-29,6.155,1251,"Science Fiction, Thriller, Horror",en
Secrets of the Neanderthals,This documentary delves into the mysteries surrounding the Neanderthals and what their fossil record tells us about their lives and disappearance.,2024-05-02,7.0,28,Documentary,en
Instant Family,"When Pete and Ellie decide to start a family, they stumble into the world of foster care adoption. They hope to take in one small child but when they meet three siblings, including a rebellious 15 year old girl, they find themselves speeding from zero to three kids overnight.",2018-11-13,7.52,2964,"Comedy, Drama",en
,"A ragtag crew of podcasters sets out to investigate mysterious disappearances from decades earlier in a charming Irish town with dark, dreadful secrets.",,6.3,81,"Drama, Mystery",en
The Reader,"The story of Michael Berg, a German lawyer who, as a teenager in the late 1950s, had an affair with an older woman, Hanna, who then disappeared only to resurface years later as one of the defendants in a war crimes trial stemming from her actions as a concentration camp guard late in the war. He alone realizes that Hanna is illiterate and may be concealing that fact at the expense of her freedom.",2008-12-10,7.472,3112,"Drama, Romance",en
Murder Mystery 2,"After starting their own detective agency, Nick and Audrey Spitz land a career-making case when their billionaire pal is kidnapped from his wedding.",2023-03-28,6.423,1705,"Mystery, Comedy, Crime",en
The Killer,"Zee is a feared contract killer known as ""the Queen of the Dead,"" but when she refuses to murder a young blind woman, she finds herself hunted both by criminal colleagues and a determined police detective.",2024-08-22,6.44,343,"Action, Thriller, Crime",en
Faithfully Yours,"Using each other as alibis, two friends sneak off to indulge in secret affairs — but their elaborate web of lies unravels when one of them goes missing.",2022-12-22,6.015,200,"Mystery, Thriller",nl
Extinction,"And suddenly, overnight, the world came to a halt. Two men, two survivors, one kid, and hatred that separates them. A place forgotten by everyone, including the creatures that inhabit the Earth... until now.",2015-08-07,6.215,668,"Action, Adventure, Drama, Horror, Science Fiction, Thriller",en
Awake,"After a sudden global event wipes out all electronics and takes away humankind’s ability to sleep, chaos quickly begins to consume the world. Only Jill, an ex-soldier with a troubled past, may hold the key to a cure in the form of her own daughter. The question is, can Jill safely deliver her daughter and save the world before she herself loses her mind.",2021-06-09,5.879,1064,"Drama, Science Fiction, Thriller",en
,Two teen ghosts work alongside a clairvoyant to solve mysteries for their supernatural clientele — until a powerful witch complicates their plans.,,7.8,232,"Drama, Mystery, Unknown",en
Fantastic Beasts: The Secrets of Dumbledore,"Professor Albus Dumbledore knows the powerful, dark wizard Gellert Grindelwald is moving to seize control of the wizarding world. Unable to stop him alone, he entrusts magizoologist Newt Scamander to lead an intrepid team of wizards and witches. They soon encounter an array of old and new beasts as they clash with Grindelwald's growing legion of followers.",2022-04-06,6.655,4536,"Fantasy, Adventure",en
Hack Your Health: The Secrets of Your Gut,Delve into the digestive system with this lighthearted and informative documentary that demystifies the role gut health plays in our overall well-being.,2024-04-26,6.8,35,Documentary,en
,"When a struggling comedian shows one act of kindness to a vulnerable woman, it sparks a suffocating obsession which threatens to wreck both their lives.",,7.6,761,Drama,en
,"A thrilling and raw crime drama following a gang of drug dealers in Hackney, London - an honest and gripping rendition of inner-city drug and gang culture.",,7.327,110,Drama,en
,"This stunning nature series narrated by Cate Blanchett explores the intelligence, resourcefulness and interconnectedness of life on our planet.",,8.2,12,Documentary,en
All Quiet on the Western Front,"At the start of World War I, Paul Baumer is a young German patriot, eager to fight. Indoctrinated with propaganda at school, he and his friends eagerly sign up for the army soon after graduation. But when the horrors of war soon become too much to bear, and as his friends die or become gravely wounded, Paul questions the sanity of fighting over a few hundreds yards of war-torn countryside.",1979-11-14,6.645,190,"War, Drama, TV Movie",en
Top Gun: Maverick,"After more than thirty years of service as one of the Navy’s top aviators, and dodging the advancement in rank that would ground him, Pete “Maverick” Mitchell finds himself training a detachment of TOP GUN graduates for a specialized mission the likes of which no living pilot has ever seen.",2022-05-21,8.2,9391,"Action, Drama",en
Rebel Moon - Part Two: The Scargiver,"The rebels gear up for battle against the ruthless forces of the Motherworld as unbreakable bonds are forged, heroes emerge — and legends are made.",2024-04-19,6.11,1193,"Science Fiction, Action",en
Rebel Moon - Part One: A Child of Fire,"When the ruthless forces of the Motherworld threaten a quiet farming village on a distant moon, a mysterious outsider becomes its best hope for survival.",2023-12-15,6.294,2180,"Science Fiction, Drama, Action, War",en
Glass,"In a series of escalating encounters, former security guard David Dunn uses his supernatural abilities to track Kevin Wendell Crumb, a disturbed man who has twenty-four personalities. Meanwhile, the shadowy presence of Elijah Price emerges as an orchestrator who holds secrets critical to both men.",2019-01-16,6.672,8510,"Thriller, Drama, Science Fiction",en
,"An old case is wrenched open when a reporter goes missing, leading his web sleuth daughter to a small mountain town haunted by a sect, secrecy and death.",,6.333,78,"Mystery, Crime, Drama",fr
The Great Wall,European mercenaries searching for black powder become embroiled in the defense of the Great Wall of China against a horde of monstrous creatures.,2016-12-16,6.028,5127,"Action, Adventure, Fantasy",en
,"Across continents and decades, five brilliant friends make earth-shattering discoveries as the laws of science unravel and an existential threat emerges.",,7.5,999,"Unknown, Mystery, Drama",en
Jurassic World Dominion,"Four years after Isla Nublar was destroyed, dinosaurs now live—and hunt—alongside humans all over the world. This fragile balance will reshape the future and determine, once and for all, whether human beings are to remain the apex predators on a planet they now share with history's most fearsome creatures.",2022-06-01,6.7,6158,"Adventure, Action, Science Fiction",en
Stolen,"The five-month-old baby of impoverished tribal woman Jhumpa Mahato is stolen. Two brothers, Gautam and Raman, who witness the kidnapping, try to help her and become embroiled in the complexities of the investigation.",2023-08-31,6.5,2,"Drama, Thriller",hi
,The queen of department stores and the prince of supermarkets weather a marital crisis—until love miraculously begins to bloom again.,,8.3,318,"Drama, Comedy, Family",ko
Reptile,"Following the brutal murder of a young real estate agent, a hardened detective attempts to uncover the truth in a case where nothing is as it seems, and by doing so dismantles the illusions in his own life.",2023-09-29,6.7,976,"Crime, Mystery, Thriller",en
,An agent in the FBI's Elite Serial Crime Unit develops profiling techniques as he pursues notorious serial killers and rapists.,,8.1,2490,"Drama, Crime",en
,"A young fan maneuvers her way into a seasoned anchor's newsroom but soon confronts the dark side of ambition, envy and the desire to be seen.",,7.1,59,Drama,tr
,"Journalist Graham Hancock travels the globe hunting for evidence of mysterious, lost civilizations dating back to the last Ice Age.",,6.5,62,Documentary,en
Ford v Ferrari,"American car designer Carroll Shelby and the British-born driver Ken Miles work together to battle corporate interference, the laws of physics, and their own personal demons to build a revolutionary race car for Ford Motor Company and take on the dominating race cars of Enzo Ferrari at the 24 Hours of Le Mans in France in 1966.",2019-11-13,8.0,8036,"Drama, Action, History",en
,A politically sensitive murder forces two disparate detectives into a battle with the Berlin underworld and a confrontation with their own corruption.,,7.034,103,"Crime, Drama",de
13 Going on 30,"A girl who's sick of the social strictures of junior high is transformed into a grownup overnight. In this feel-good fairy tale, teenager Jenna wants a boyfriend, and when she's unable to find one, she fantasizes about being a well-adjusted adult. Suddenly, her secret desire becomes a reality, and she is transformed into a 30-year-old, but adulthood, with its own set of male-female challenges, isn't as easy as it looks.",2004-04-13,6.751,5132,"Comedy, Fantasy, Romance",en
,"After spending graduation night together, Emma and Dexter go their separate ways — but their lives remain intertwined.",,7.7,198,Drama,en
,"Geralt of Rivia, a mutated monster-hunter for hire, journeys toward his destiny in a turbulent world where people often prove more wicked than beasts.",,8.048,5927,"Unknown, Drama, Unknown",en
The Abyss,"A civilian oil rig crew is recruited to conduct a search and rescue effort when a nuclear submarine mysteriously sinks. One diver soon finds himself on a spectacular odyssey 25,000 feet below the ocean's surface where he confronts a mysterious force that has the power to change the world or destroy it.",1989-08-09,7.4,2994,"Adventure, Action, Thriller, Science Fiction",en
Pieces of a Woman,"When a young mother's home birth ends in unfathomable tragedy, she begins a year-long odyssey of mourning that fractures relationships with loved ones in this deeply personal story of a woman learning to live alongside her loss.",2020-12-30,7.033,1215,Drama,en
The Devil Wears Prada,"Andy moves to New York to work in the fashion industry. Her boss is extremely demanding, cruel and won't let her succeed if she doesn't fit into the high class elegant look of their magazine.",2006-06-29,7.394,12082,"Drama, Comedy",en
Divergent,"In a world divided into factions based on personality types, Tris learns that she's been classified as Divergent and won't fit in. When she discovers a plot to destroy Divergents, Tris and the mysterious Four must find out what makes Divergents dangerous before it's too late.",2014-03-14,6.915,12820,"Action, Adventure, Science Fiction",en
,"Lifelong friends Maddie, Helen and Dana Sue lift each other as they juggle relationships, family and careers in the small, Southern town of Serenity.",,7.768,235,Drama,en
Under the Tuscan Sun,"After a rough divorce, Frances, a 35-year-old professor and writer from San Francisco takes a tour of Tuscany at the urgings of her friends. On a whim she buys Bramasole, a run down villa in the Tuscan countryside and begins to piece her life together starting with the villa and finds that life sometimes has unexpected ways of giving her everything she wanted.",2003-09-20,6.9,874,"Romance, Comedy",en
,"Inspired by real events, this fictional dramatization shows Griselda Blanco's journey from Medellín to becoming ""the Godmother"" of Miami's drug empire.",,7.323,311,"Drama, Crime",en
,"While running from a drug deal gone bad, Mike Ross, a brilliant young college-dropout, slips into a job interview with one of New York City's best legal closers, Harvey Specter. Tired of cookie-cutter law school grads, Harvey takes a gamble by hiring Mike on the spot after he recognizes his raw talent and photographic memory.",,8.231,5122,Drama,en
What Happens in Vegas,"During a wild vacation in Las Vegas, career woman Joy McNally and playboy Jack Fuller come to the sober realization that they have married each other after a night of drunken abandon. They are then compelled, for legal reasons, to live life as a couple for a limited period of time. At stake is a large amount of money.",2008-05-07,6.1,3047,"Comedy, Romance",en
The Proposal,"When she learns she's in danger of losing her visa status and being deported, overbearing book editor Margaret Tate forces her put-upon assistant, Andrew Paxton, to marry her.",2009-06-02,7.154,6893,"Comedy, Romance, Drama",en
Pretty Woman,"While on a business trip in Los Angeles, Edward Lewis, a millionaire entrepreneur who makes a living buying and breaking up companies, picks up a prostitute, Vivian, while asking for directions; after, Edward hires Vivian to stay with him for the weekend to accompany him to a few social events, and the two get closer only to discover there are significant hurdles to overcome as they try to bridge the gap between their very different worlds.",1990-03-23,7.467,8315,"Romance, Comedy",en
Last Call for Istanbul,"A chance meeting at the airport leads two married people to an unforgettable night full of excitement, desire, and temptation in New York City.",2023-11-24,6.5,116,"Romance, Drama",tr
The Holiday,"Two women, one from the United States and one from the United Kingdom, swap homes at Christmas time after bad breakups with their boyfriends. Each woman finds romance with a local man but realizes that the imminent return home may end the relationship.",2006-12-05,7.1,5165,"Comedy, Romance",en
The Tailor,A gender non-conforming person struggling to assert their identity unexpectedly finds courage in an aging master tailor.,2020-05-31,2.0,1,Drama,en
,"With never-before-seen footage, this docuseries follows David Beckham's meteoric rise from humble beginnings to global football stardom.",,8.1,131,Documentary,en
,"Life's extraordinary journey to conquer, adapt and survive on Earth across billions of years comes alive in this groundbreaking nature docuseries.",,8.0,158,Documentary,en
,An amphibious shark-like monster attacks an abandoned secret military base and the people who live on the island.,,4.8,67,Unknown,en
,"A coming-of-age story about an outsider who, against all odds and numerous challenges, fights for love and acceptance and for her place in the world. The series centers on a young orphaned girl in the late 1890’s, who, after an abusive childhood spent in orphanages and the homes of strangers, is mistakenly sent to live with an elderly woman and her aging brother. Over time, 13-year-old Anne will transform their lives and eventually the small town in which they live with her unique spirit, fierce intellect and brilliant imagination.",,8.7,4673,"Drama, Family",en
,"Meet the most beloved sitcom horse of the 90s - 20 years later. BoJack Horseman was the star of the hit TV show ""Horsin' Around,"" but today he's washed up, living in Hollywood, complaining about everything, and wearing colorful sweaters.",,8.6,2436,"Animation, Comedy, Drama",en
Pain Hustlers,"After losing her job, a single mom falls into a lucrative but ultimately dangerous scheme selling prescription drugs.",2023-10-20,6.6,629,Drama,en
,"Privacy is needed by all, but can all enter the private zone? Hoichoi presents “Do Not Disturb” narrating six stories happening at six rooms. Will you check in?",,0.0,0,Drama,bn
The Invention of Lying,"Set in a world where the concept of lying doesn't exist, a loser changes his lot when he invents lying and uses it to get ahead.",2009-10-02,6.2,2113,"Comedy, Fantasy, Romance",en
Eat Pray Love,"Liz Gilbert had everything a modern woman is supposed to dream of having – a husband, a house and a successful career – yet like so many others, she found herself lost, confused and searching for what she really wanted in life. Newly divorced and at a crossroads, Gilbert steps out of her comfort zone, risking everything to change her life, embarking on a journey around the world that becomes a quest for self-discovery. In her travels, she discovers the true pleasure of nourishment by eating in Italy, the power of prayer in India and, finally and unexpectedly, the inner peace and balance of true love in Bali.",2010-08-12,6.2,2438,"Drama, Romance",en
,"The story of how the young Queen Charlotte’s marriage to King George sparked both a great love story and a societal shift, creating the world of the Ton inherited by the characters in Bridgerton.",,8.1,522,Drama,en
Illegal Lives,"Mahsun constantly has to cope with police raids since he runs an illegal casino. Because he wants to continue to run this casino, Mahsun decides to establish a fake political party as a disguise. His aim is to keep the casino able to continue operating in secret without any interference. However, this idea leads him and his friends into an unexpected outcome.",2023-01-13,5.5,23,Comedy,tr
,"The story of Claire Randall, a married combat nurse from 1945 who is mysteriously swept back in time to 1743, where she is immediately thrown into an unknown world where her life is threatened. When she is forced to marry Jamie, a chivalrous and romantic young Scottish warrior, a passionate affair is ignited that tears Claire's heart between two vastly different men in two irreconcilable lives.",,8.2,2603,"Drama, Unknown",en
,"Hiding a mysterious past, a mother lives like a nameless fugitive with her daughter as they make hotels their home and see everyone else as a threat.",,6.8,46,"Crime, Mystery, Drama",tr
